{
  "$schema": "http://json-schema.org/draft-07/schema#",
  "migration_policy": "replace-old-techniques",
  "properties": {
    "deny_by_default": {
      "migration_policy": "replace-old-techniques",
      "release_status": "pre-alpha",
      "stability": "experimental",
      "type": "boolean",
      "unreleased": true
    },
    "migration_policy": "replace-old-techniques",
    "release_status": "pre-alpha",
    "rules": {
      "items": {
        "migration_policy": "replace-old-techniques",
        "properties": {
          "action": {
            "migration_policy": "replace-old-techniques",
            "release_status": "pre-alpha",
            "stability": "experimental",
            "type": "string",
            "unreleased": true
          },
          "effect": {
            "enum": [
              "allow",
              "deny"
            ],
            "migration_policy": "replace-old-techniques",
            "release_status": "pre-alpha",
            "stability": "experimental",
            "unreleased": true
          },
          "migration_policy": "replace-old-techniques",
          "principal": {
            "migration_policy": "replace-old-techniques",
            "release_status": "pre-alpha",
            "stability": "experimental",
            "type": "string",
            "unreleased": true
          },
          "release_status": "pre-alpha",
          "resource": {
            "migration_policy": "replace-old-techniques",
            "release_status": "pre-alpha",
            "stability": "experimental",
            "type": "string",
            "unreleased": true
          },
          "stability": "experimental",
          "unreleased": true
        },
        "release_status": "pre-alpha",
        "stability": "experimental",
        "type": "object",
        "unreleased": true
      },
      "migration_policy": "replace-old-techniques",
      "release_status": "pre-alpha",
      "stability": "experimental",
      "type": "array",
      "unreleased": true
    },
    "stability": "experimental",
    "unreleased": true
  },
  "release_status": "pre-alpha",
  "stability": "experimental",
  "title": "PolicyDSL",
  "type": "object",
  "unreleased": true
}