{
  "deny_by_default": true,
  "migration_policy": "replace-old-techniques",
  "release_status": "pre-alpha",
  "rules": [
    {
      "action": "route",
      "effect": "allow",
      "migration_policy": "replace-old-techniques",
      "principal": "service.router",
      "release_status": "pre-alpha",
      "resource": "domain:public",
      "stability": "experimental",
      "unreleased": true
    }
  ],
  "stability": "experimental",
  "unreleased": true
}